"Pies","Fruits Of The Forest Pie-2003 First Place Nut","8","\nCrust:\n1/3 cup solid shortening (recommended: Crisco)\n2 tablespoons butter\n2 tablespoons ice water\n1 cup all-purpose flour\nFilling:\n4 eggs, lightly beaten\n1/4 cup packed brown sugar\n1/2 cup white sugar\n1 teaspoon vanilla\nI cup light corn syrup\n1/2 teaspoon salt\n4 tablespoons melted butter\n2 cups lightly toasted mixed nuts (1/2 cup pecan halves, 1/3 cup coarsely chopped macadamias, 1/3 cup slivered almonds, 1/2 cup cashew\nhalvessplit, 1/3 cup chopped hazelnuts)\n","To prepare crust by hand:\nIn a narrow bowl, combine flour, salt and shortening. Using 2 knives scissors-style, cut fat into flour until only small pea-size bits of shortening remain.\nSprinkle water over flour mixture as you toss with a fork. Don't keep stirring. Turn only about 8 to 10 times. Continue with Step 3 below.\nOr prepare crust using a food processor:\nChill flour, shortening, butter, water.\nMeasure flour into work bowl. Add salt and pulse 3 times.\nAdd shortening. Pulse 6 times. Add butter that has been cup up into chunks. Pulse 4 times.\nAdd water 1 tablespoon at a time. Pulse after each addition.\nPour out of bowl onto plastic wrap. Create a 5-inch disk and flatten. Refrigerate.\nAfter about 15 minutes in the refrigerator, remove your disc. Place a piece of plastic wrap or parchment paper on the counter. Flour it. Cover the\ndisk with another piece of wrap or parchment. Roll out from the center, until disk is about 11 inches in diameter. Remove top wrap, flour the surface\nlightly and drape crust over rolling pin. Center over pie plate and put it in. Smooth into 9 1/2-inch pie pan. Remove wrap. Trim edge to about 1/2\ninch around outside of pan.\nFold edge under and flute using thumb and forefingers to make a stand up edge. Refrigerate until ready to fill.\nTo prepare filling and topping:\nHeat oven to 350 degrees F.\nCoarsely chop macadamias and almonds, put all nuts (separate large nuts from chopped) on cookie sheet and toast 5 to 6 minutes. Cool. Put\nhazelnuts into a kitchen towel and rub together to remove skins. Chop hazelnuts.\nCombine filling ingredients. Mix well. Sprinkle chopped nuts on bottom of crust. Arrange pecan halves, slivered almonds and cashews in attractive pattern on bottom of unfilled crust. Pour filling into pan deflecting on back of a spoon. Larger nuts will rise up to top. Cover edge of crust with foil.\nBake for 45 minutes to 50 minutes. Test with a stainless steel knife in center. When it comes out clean, it's done. Cool completely on wire rack.\nServe after cooling or wrap in heavy foil and refrigerate until next day to serve.","Television Food Network"
"Vegetables","FRESH ORANGE SWEET POTATOES","8","\n3 cups cooked mashed sweet potatoes\n1/2 cup sugar\n1/4 cup milk\n2 large eggs\n1 teaspoon vanilla extract\n1 stick butter, melted\n1/3 cup all-purpose flour\n1 teaspoon freshly grated orange zest (peel)\n2 tablespoons fresh\n2 tablespoons fresh orange juice\nTopping:\n1 cup chopped pecans\n1 cup brown sugar\n4 tablespoons butter, melted\n1/3 cup all-purpose flour\n","\npreheat oven to 350 degrees. combine sweet potatoes and next 8 \ningredients in a large mixing bowl. Pour into a greased 2-quart \nbaking dish. Combine topping ingredients in a small bowl and sprinkle \nover sweet potato mixture.  Bake 40 minutes. Serve immediately. \n\n",""
"Cookies","APRICOT SHORTBREAD","","\n2 sticks butter\n1 cup sugar\n2 eggs beaten\n2 cups flour\nsalt\n12 oz. apricot preserves \n1/2 cup pecans or almonds \n\n\n","Beat butter and sugar until creamy.\nAdd remaining ingredients except for preserves and nuts.\n\nPour 1/2 of batter in a 9x13 in. pan\nUse 1/2 preserves and nuts in center and 1/2 on top, or use all on top.\n\nBake @ 350* 30 to 40 minutes or\nuntil brown",""
"Vegetables","FRIED GREEN TOMATOES","4-6","1 large egg, lightly beaten\n1/2 cup buttermilk\n1/2 cup flour\n1/2 cup cornmeal\n1 teaspoon salt\n1/2 teaspoon pepper\n3 medium size green tomatoes, cut into 1/2"" slice\nVegetable oil\nSalt to taste","Combine egg and buttermil;\nCombine 1/4 cup flour, cornmeal salt, pepper; Dredge tomato slices in remaining 1/4 cup flour; dip in egg mixture, and dredge in cornmeal mixture.\n\nPour oil  to a depth of 1/4 to 1/2"" in large cast iron skillet; heat to 375*.  Drop tomatoes in batches into hot oil, and cook 2 minutes on each side until golden.  Drain on paper towels or rack.  Sprinkle hot tomatoes with salt.","Southern Living, July 2003"
"Seafood","GARLIC SHRIMP","2","2 dozen large fresh shrimp\n1/4 cup olive oil\n1/4 cup chopped fresh parsley\n3 cloves garlic, minced\n12 teaspoon dried crushed red pepper\n1/4 teaspoon pepper\n1/4 cup Butter\n1/2 cup French breadcrumbs, toasted\n12 cup freshly grated Parmesan cheese\n\n","Peel ,devein shrimp.  Arrange in a 11 x 7"" baking dish; pour olive oil over shrimp.  Combine parsley and next 3 ingredients; sprinkle over shrimp.  Cover and bake at 300* for 15 minutes\n\nTurn shrimp over; drizzle with butter, and sprinkle with breadcrumbs and cheese.  Bake, uncovered 5 to 10 minutes. ","Southern Living"
"Vegetables","PESTO GREEN BEANS","8","2 lbs. fresh green beans, trimmed\n1/4 cup butter\n2 garlic cloves, pressed\n1 teaspoon dried pesto seasoning*\n1/2 teaspoon salt","Steam green beans over boiling water.  Cover and steam 6 minutes until crisp tender.\nMelt butter in large skillet; stir in garlic, pesto and salt; saute about 1 minute.  Add green beans and saute 2 minutes or until thoroughly heated.  Serve","*I use frozen pesto made from garden.\n\nSouthern Living, August 2003, page182"
"Appetizers","CHESAPEAKE BAY PARTY NUTS","2 cups","2 Tablespoons butter, melted\n2 teaspoons Old Bay Seasoning\n2 Tablespoons Worchestershire sauce\n1/2 teaspoon garlic powder\n1/4 to 1/2 teaspoon hot sauce\n2 cups pecans\n2 cups almonds","Stir together melted butter, Old Bay, Worchestershire, garlic powder and hot sauce.  \nAdd nuts, tossing to coat. \n\nPlace nuts on an aluminum foil lined 15-x 10 inch jelly roll pan.\n\nBake nuts at 300* for 30 minutes, stirring twice.  Cool.  Store in air tight container.\n\nBe careful not to over cook.","Southern Living, August 2003, p. 185"
"Sandwiches","PINEAPPLE-TURKEY MELT","6","1 (20-ounce) cane pineapple slices\n2 Tablespoons butter\n1/2 teaspoon salt\n1/2 teaspoon pepper \n1 (8-ounce) container soft chive-onion cream cheese\n1 (8-ounce) French bread  loaf, split\n1 pound sliced turkey or chicken\n1 (8-ounce) [aclage Swoss cjeese s;oces","Drain pineapple cut each slice in half.\nMelt butter, add pineapple, and saute 2 to 3 minutes.  Sprinkle with salt and pepper.\nSpread cream cheese on each bread half.  Layer bottom bread halves with pineapple, turkey, and cheese slices; top with French bread halves.\nCook sandwiches on a lightly greased griddle over medium heat 5 minutes on each side until bread is toasted and cheese melts.  Cut sandwiches into thirds.","Southern Living, Sept. 2003, page 134"
"Grains","WILD RICE","8","2 1/2 c chicken stock\n1 1/2 c wild rice\n1 med onion, minced fine\n2 stalks celery, minced fine\n2/3 c dry white wine.\n\nsalt and pepper to taste\n2 T butter, softened\n","\nHeat stock to boil.  Combine boiling stock and wild rice over top of double boiler, heated and set over medium heat.  Lightly season rice with salt and pepper and cover tightly.  Cook over med heat for 1 hour.\n\nAs soon as rice begins to cook, heat 2 T butter in saucepan over med high heat.  When hot, add onion and celery, season with salt and pepper and saute for 3 minutes.  Add the white wine, reduce heat to low and allow to simmer until almost all liquid has evaporated, about 45 to 50 minutes.  Combine rice and vegetables, adjust the seasoning and serve immediately or cool and keep refrigerated.\n","The Trellis Cook book"
"Seafood","SHRIMP CREOLE","6-8","\n2 lb. shrimp\n4 slices bacon, chopped\n2 Tablespoons butter\n1 clove garlic, minced\n1 cup chopped onion\n1 1/2 cup chopped green pepper\n1/4 cup chopped parsley\n1 1/2 cup thinly sliced celery\n1 large can (1 lb 12 oz) tomato\n1 can (6 oz) tomato paste\n1 Tablespoon lemon juice\n1 teaspoon salt (or to taste)\n1/4 to 1/2 teaspoon pepper\n1/4 to 1/2 teaspoon red pepper flakes \n1 bay leaf\n1/2 teaspoon thyme\n1 cup water\n1/2 cup red wine (optional)\n\nCooked White Rice","\nSaute bacon in large pot.  When crisp, remove and drain.  To the bacon fat, add the butter, garlic, onion, gr. pepper, parsley, and celery.  Saute for about 5 minutes, stirring, or until veggies are tender.  Add the bacon, and remaining ingredients EXCEPT shrimp and simmer, covered, 30 minutes (or longer if desired).  Just before serving, add shrimp and bring to boil.  Reduce heat and cook until shrimp is just pink and curled (will depend on size of shrimp).  Serve over rice.  Yum!\n\n\n\n","This is great as it can be made ahead.  Just make the sauce without the shrimp and refrigerate or freeze.  When ready to use, just bring to boil, add the shrimp and continue as directed."
"Appetizers","ROASTED BEEF AND BLUE CHEESE PINWHEELS","6 dozen"," 1 stick butter, softened\n 1 8 ounce cream cheese\n 4 ounces crumbled blue cheese\n roasted red peppers\n basil leaves\n sliced roast beef\n flour tortilla wraps","Beat butter, cream cheese, salt and blue cheese at medium speed with electric mixer until creamy.  spread 2 to 3 tablespoons mixture in center of each tortilla.\n\nPlace sliced red peppers in rows 1 inch apart over cheese mixture to within 1/2 inch of edge.\nPlace basil between rows of peppers.  (Do not overlap.)\n\nPlace roast beef over peppers and basil, covering tortilla to within 1/2 inch of edge.  Roll up\ntightly, jelly roll fashion; cover with plastic wrap and chill.\n\nUnwrap rolls; cut off and discard 1/2 inch from each end.  Cut rolls into 3/4 inch slices.  Place pinwheels, cut side down on serving platter.  Makes six dozen pinwheels.\n",""
"Pies","OH! GOD PIE ","16","Pie Crust \n (Makes 2 pie crusts)\n1 1/2 cups flour\n1 stick butter\n1 cup finely chopped pecans\n\nFilling: \n8 ounces cream cheese\n1 can Eagle Brand Sweetened Condensed Milk\n16 ounces cool whip\nMix:\n7 ounces coconut\n1/2 stick melted butter\n1 cup chopped pecans\n\n12-ounce jar of caramel sauce \n\n","Make pie crust and bake 10 minutes at 350*\nCombine and pour first three filling ingredients into cooked, cooled pie shells.\nSpread coconut, butter and pecan mixture on cookie sheet and toast until lightly browned.\nSpread toasted coconut mixture on top of the pies.\nPour 12-ounce jar of caramel sauce over the pies\nFreeze.  Partially thaw before serving.\n","from the ""Sweet Potato Queens Book of Love Cookbook"""
"","","","","",""
"Condiment","BASIL PESTO","1 cup","2 cups loosely packed fresh basil leaves\n3 large cloves garlic\n1/2 cup Shredded Parmesan cheese\n1/2 cup pine nuts, toasted\n1/2 cup olive oil\n2 Tablespoons Greek oregnao leaves\n2 Teablespoons parsley\n1/8 teaspoon salt","Process fresh basil leaves and remaining ingredients in food processor until smooth.  Stoere in refrigerator up to 5 days","Southern Living Magazine."
"Condiment","POBLANO-CILANTRO PESTO","1 1/4 cups","4 poblano chile peppers\n3/4 cup freshly grated Parmesan cheese\n1/2 cup fresh cilantro\n1/4 cup chopped walnuts\n3/4 cup olive oil\n3 garlic cloves\n3 tablespoons fresh lime juice\n1 teaspoon salt","Place peppers on aluminum foil lined baking sheet.\nBroil about 5 minutes until each side is blistered.\nPlace peppers in a zup loc plastic bag; seal and let stand 10 minutes until skins are loose.  Peel, remove and discard seeds.\n\nProcess peppers and remaining ingredients in a food processor until smooth.  Store in refrigerator up to 1 week.","Southern Living Magazine."
"Beverages","STRAWBERRY MARGARITA","5 1/2 cups","1  8 ounce package frozen strawberries partially \n    thawed\n5 cups ice\n3/4 cup tequila\n1/2 cup thawed limeade concentrate\n1/3 cup powdered sugar\n3 tablespoons orange liqueur\nLime juice\nRed sugar crystals\nGarnishes:  lime slices, fresh strawberies","Place first 6 ingredients in a blender until smooth.\nDip margarita glass rims in lie juice; dip rims in red sugar crystals, coating well.  Pour margarita mixture into glasses.  Serve immediately.  Garnish.\n\n\n\n\n\nJOTE:  Used Grand Marnier","Southern Living"
"Cakes","MISSISSIPPI MUD CAKE","15","1 cup butter, melted\n2 cups sugar\n1/2 cup unsweetened cocoa\n4 large eggs, lightly beaten\n1 teaspoon vanilla extract\n1/8 teaspoon salt\n1 1/2 cups all purpose flour\n1 1/2 cups coarsely chopped pecans, toasted\n1  10 ounce bag miniature marshmallows\nChocolate Frosting(next)","Whisk together melted butter and next 5 ingredients.  Stir in flour and chopped pecans.  Pour batter into a greased and floured 15 x 10 inch jelly roll pan.\nBake at 350* for 20 to 25 minutes.  Remove from oven; top warm cake evenly with marshmallows.  Return to oven, and bake 5 minutes.  Drizzle Chocolate Frosting over warm cake.  Cool.\n","2  19.5 ounce packages brownie mix, prepared according to directions may be substituted.  Stir in pecans, bake 350* for 30 minutes. Proceed with marshmallows and frosting as directed\n"
"Cakes","CHOCOLATE FROSTING","2 cups","1 1/6 ounce package powdered sugar, sifted\n1/2 cup milk\n1/4 cup butter, softened\n1/3 cup unsweetened cocoa","Beat all ingredients at medium speed with an electric mixer until smooth","Southern Living 6/04"
"Pasta","FETTUCCINE/PORTOBELLO-ALFREDO SAUCE","6 to 8","1  12 ounce package fettuccine\n1  6 ounce package portobello mushrooms\n1/2 cup butter\n3 garlic cloves, mimced\n1 cup whipping cream\n1 cup milk\n1 cup (4 ounces) shredded Parmesan cheese\n1 teaspoon coarsely ground pepper\n1/2 teaspoon salt\n2 tablespoons chopped fresh Italian flat leaf parsley","cook pasta .\nRemove brown gills from undersides of mushroom caps using a spoon.  discard gills; chop mushrooms.\nMelt butter in a large saucepan add mushrooms and galric, saute 5 to 6 minutes.  Stir in cream and milk.  Bring to a boil, reduce heat, and simmer, whisking constantly 10 minutes.  Stir in cheese, pepper, and salt.  Stir constantly until cheese melts and mixture thickens.  Stir in 2 tablsspoons parsley.  Serve over hot cooked pasta.\n\nGarnosj","Southern Living"
"Sauces","SPICY PEANUT SAUCE","1 1/3 cups","2/3 cup chicken broth\n1/3 cup chunky peanut butter\n 3 Tablespoons lite soy sauce\n3 tablespoons fresh lime juice\n1 Tablespoon honey\n1 tomato, peeled, seeded, and chopped\n4 green onions, minced\n2 garlic cloves, minced\n1 Tablespoon minced fresh ginger\n1 jalapeno pepper, seeded and minced\n1/4 cup chopped cilantro","Bring first 11 ingredients to a boil in a small saucepan over medium-high heat.  Reduce heat, and smiier, whisking constantly 2 minutes or until thick and creamy.","Serve with grilled chicken or pork."
"Sauces","GINGERED JEZEBEL SAUCE","1 1/4 cup","2/3 cup ineapple preserves\n1/3 cup apple jelly\n2 tablespoons prepared horseradish\n1 tablespoon grated fresh ginger","Microwave pineapple preserves and apple jelly in a glass bowl at HIGH 2 minutes or until melted.  Stir in remaining ingredients","Southern Living"
"Eggs","DEVILED EGGS W/ CAPERS & TARRAGON","12 halves","6 hard boiled eggs\n3 Tablespoons sour cream\n2 Tablespoons mayonnaise\n2 teaspoons fresh lemon juice\n1/4 teaspoon dry mustard\n2 Tablespoons green onions, chopped\n4 teaspoons capers\n1 teaspoon fresh tarragon, chopped ","Peel eggs, cut in half lengthwise.\n\nMix yolks with other ingredients and stuff back into shells.",""
"","","","","",""
"Vegetables","Roasted Eggplant and red Pepper Topping","6","3/4        lb eggplant, left unpeeled and cut into  1/4-inch dice \n1        medium onion, chopped \n1        red bell pepper, chopped \n3        tablespoons extra-virgin olive oil \n3/4        teaspoon salt \n1/4       teaspoon black pepper \n2        tablespoons chopped fresh basil \n\n","Preheat oven to 450F. \nToss vegetables with oil, salt, and pepper in a bowl, then spread in an oiled large shallow (1-inch-deep) baking pan. Roast vegetables in middle of oven, stirring occasionally, until tender, 25 to 30 minutes. Cool in pan on a rack, then coarsely mash with a potato masher and stir in basil. \n","\n Vegetables can be roasted and mashed 1 day ahead and chilled, covered. Bring to room temperature, then stir in basil just before serving. \n"
"Vegetables","BRAISED EGGPLANT WITH ONION AND TOMATO \n","6","6   small Italian eggplants  (2 lb total) \n2    medium onions, cut lengthwise into 1/4-    inch-thick wedges \n1/4  cup plus 3 tablespoons  extra-virgin olive oil \n1  large tomato, coarsely chopped, plus 1 1/2 cups drained chopped tomatoes from stuffed tomatoes \n1/3  cup chopped fresh  flat-leaf parsley \n1/3   cup chopped fresh basil \n3       tablespoons fresh lemon juice \n1        tablespoon plus  2 teaspoons sugar \n1        teaspoon salt \n1/3     cup water \n","\nPreheat oven to 400F. \nHalve eggplants lengthwise and score flesh 1/2 inch deep in a crosshatch pattern to make 1-inch squares (do not cut through skin). Arrange eggplant halves, cut sides up, in a large roasting pan and season with salt. \nCook onions in 3 tablespoons oil in a large nonstick skillet over moderate heat, stirring occasionally, until softened, about 10 minutes. Remove skillet from heat and stir in tomatoes, parsley, basil, lemon juice, 2 teaspoons sugar, and salt. \nDivide topping among eggplant halves, mounding in centers. Stir together water, remaining 1/4 cup oil, and remaining tablespoon sugar until sugar is dissolved, then add to roasting pan. Cover pan tightly with foil and bake in middle of oven, basting eggplants every 15 minutes with cooking liquid, 45 minutes. Uncover and bake until eggplants are tender (they will collapse and flatten slightly) and cooking liquid is reduced and beginning to caramelize, about  40 minutes more. Serve hot or at room temperature, drizzled with pan juices. \n\n\n\n\n\n\n"," Braised eggplant may be made 1 day ahead, then cooled completely before being chilled, covered. Bring to room temperature before serving. "
"Pies","LEMON CHEESE TART","8 to 10","Pie dough recipe including lemon peel\n\n3/4 cup bottled lemon curd\n2 1/2 cups cottage cheese\n1/2 cup sour cream\n6 Tablespoons sugar\n1/4 teaspoon salt\n1 1/2 teaspoon freshly grated lemon peel\n1 teaspoon vanilla extract\n2 eggs\n1 Tablespoon flour\nThin lemon slices or sliced almonds or whipped cream as garnish","Preheat oven to 325*\nPrepare pie dough in a 10-inch tart pan.  Spread lemon curd on the bottom of the pastry*\nCombine the remaining ingredients except garnishes in a food processor and process until smooth and uniform. Pour into the pastry shell.\n\nBake 35 minutes or until set.  Let cool, refrigerate and chill.  Garnish","I baked pastry some before filling.\nFrom Virginian Pilot/6/16/04"
"Sandwiches","BEEF ROLL UPS","","Flour Tortillas \nThin sliced roast beef\nRoasted red peppers\nFresh Basil \n8 ounces cream cheese\n1 stick butter\nsmall carton crumbled blu cheese ","Soften cheeses and butter; combine until smooth; spread to within 1/2"" of edge of tortilla.\n\nAlternate rows of sliced peppers and fresh basil leaves.  Do not overlap rows.\n\nPlace sliced beef on top.\n\nRoll up in plastic wrap,  store in  refrigerator.  Slice in desired thickness.",""
"Cookies","GINGERED SHORTBREAD","3 dozen cookies","2 to 2 1/2 cups flour, plus flour for work surface\n1/4 cup rice flour (substitute cornstarch)\n2 sticks butter, softened\n1/4 cup packed brown sugar\n1/4 cup superfine sugar\n1 large egg\n1 tablespoon milk\n1 teaspoon ground ginger\n1 teaspoon cinnamon\n","Mix butter and sugars; add egg, milk, ginger, cinnamon and mix.  Reduce speed and add flours.\nBeat until dough pulls away from the sides of the bowl.\nRoll out and cut into shapes and bake at 325*\n\nDough may be shaped into rolls and stored in refrigerator until ready to bake.  Slice 1/4"" thick.\nBake about 20 minutes until lightly browned.  A thinner roll of dough will yield more cookies; the thinner cookies will take less time to bake.","I used 1/4 cup Splenda and 3/4 cup brown sugar and added an extra egg."
"Cookies","MOCHA-CHOCOLATE SHORTBREAD","50 triangles","1 1/4 cups flour\n1/2 cup powdered sugar\n2 teaspoons instant coffee granules\n2/3 cup butter or margarine\n1/2 teaspoon vanilla extract\n2 cups (12-ounces) semisweet chocolate morsels\n    (divided)\nVanilla or coffee ice cream (optional)\n","Combine first 3 ingredients; add butter and vanilla, and beat at low speed until blended.  Stir in 1 cup chocolate morsels.\n\nPress dough into an ungreased 9-inch square pan, prick dough with a fork.\n\nBake at 325* for 20 minutes or until lightly browned; sprinkle remaining cup morsels over top and spread to cover.\n\nCut shortbread into 25 squares; cut each square into 2 triangles  Let cool 30 minutes in pan before removing.","Southern Living, July 2004"
"Desserts","SPICY TROPICAL FRUIT","7 cups","1 (8oz) container light sour cream\n1 (8 oz) container plain yogurt\n1/4 cup honey\n2 tablespoons chopped crystallized ginger\n1/4 teaspoon ground allspice\n1/4 teaspoon salt\n1/8 to 1/4 teaspoon ground red pepper (optional)\n3 ripe mangoes, peeled, seeded, and diced\n3 bananas, peeled and diced \n1 (15.25 ounce ) can pineapple tidbits, drained\nGarnish: 1/4 cup pistachios, toasted and chopped","Stir together first 6 ingredients, Fold in mangoes, bananas, and pineapple.\n\nCover and chill at least 2 hours.  Garnish if desired.","Southern Living August 2004"
"Beverages","CRANBERRY APPLE CRUSH","8-10","5 cups apple cider or apple juice\n5 cups cranberry juice\n1 1/2 cups guava juice or mango nectar\n1/4 cup lime juice\n1 teaspoon ground ginger\n1/2 teaspoon ground cinnamon\n1/2 teaspoon ground allspice\nHoney (optional)\nKumquats (optional)\nLime slices (optional)","In a 4-quart Dutch oven combine apple cider, cranberry juice, guava juice, lime juice, ginger, cinnamon, and allspice.  Bring t boil; reduce heat.  Simmer for 5 minutes, stirring occasionally.  If desired, sweeten to taste with honey.\n\nPour into mugs; garnish with lime slices and kumquats.","Better Homes & Gardens, October 2004"
"Salads","Roasted Red Bell Pepper & Fennel Salad","4","2 large red bell peppers*\n\n5 Tablespoons fresh lemon juice\n3 garlic cloves, minced\n2 Tablespoons extra-virgin olive oil\n1/4 teaspoon dried crushed red pepper\n\n1 medium fennel bulb, trimmed, thinly sliced\n   fronds chopped and reserved\n\n6 cups mixed baby greens \n1/4 cup halved putted Kalamata olives\n Parmesan cheese shavings ","Char broil peppers, sweat in paper bag, peel, etc.\n\nWhisk lemon juice, oil, garlic, and dried crushed pepper to blend.  Season to taste with salt and pepper.\n\nToss sliced fennel bulb with half of dressing in medium bowl.  Toss red peppers and remaining dressing in another medium bowl.\nDivide greens among 4 plates.  Arrange fennel and red peppers over.  Sprinkle reserved fennel fronds, olives, and Parmesan shavings over.  Salt and Pepper to taste.","*I used Trader Joe's blackened, peeled peppers\n\nBon Appetit, September 2004"
"Pies","STRAWBERRY MOUSSE PIE","","1 Graham cracker pie crust\n1 packet unflavored gelatin\n1/4 cup cold water\n 2 cups strawberries, sliced\n1/4 cup extra fine granulated sugar\n1 cup heavy cream\n3 Tablespoons powdered sugar","Sprinkle gelatin over cold water in saucepan; let stand 1 minute to soften; stir over low heat until gelatin is dissolved.  \n\nPlace berries, extra fine sugar and gelatin mixture in food processor; puree; pour into bowl.  Chill until mixture mounds when dropped from spoon.  \nBeat cream and powdered sugar until soft peaks form, stir 1/4 of cream into strawberry puree; fold in remaining cream;  pour into crust.  \n\nRefrigerate for 2 hours before serving.",""
"Appetizers","HAM DELIGHTS","","1 cup ground ham\n1/2 cup butter, softened\n3 Tablespoons prepared mustard \n1 teaspoon poppy seeds\n1/3 cup Swiss cheese, grated\n1/3 cup sharp cheddar cheese, grated\n1/3 cup Parmesan cheese, grated\n1/3 cup Asiago cheese, grated\n1/3 cup chopped green onions\n1 teaspoon Lea & Perrins worchestershire sauce\nRolls or biscuits","Combine all ingredients.\n\nSlice rolls or biscuits and place small amount of filling in each.  \n\nWarm rolls in pan covered with aluminum foil in 350* oven for 10-15 minutes.\n\nGarnish with lettuce if desired.",""
"Appetizers","PINK LEMONADE-LIME DIP","1 3/4 cups","1  14-ounce can sweetened condensed milk\n1   6-ounce can frozen pink lemonade concentrate, thawed\n1 teaspoon grated lime rind","Stir all ingredients in a small bowl until blended\n\nCover and chill 2 hours.","Use as a dip for fresh fruit or with sugar cookies for an easy dessert"
"Sauces","JAVA CHOCOLATE SAUCE","1 1/4 CUPS","1  12-ounce package semisweet chocolate morsels\n1/2 cup whipping cream\n1 tablespoon butter or margarine\n1/4 cup strong brewed coffee","Heat chocolate morsels, cream, and butter in saucepan over low heat until chocolate and butter melt; stirring often.\n\nCook stirring constantly, 2 to 3 minutes until smooth.\n\nRemove from heat; stir in coffee.  Serve warm.",""
"Pies","WALNUT FUDGE PIE","8","3 large eggs, beaten\n1/2 cup firmly packed brown sugar\n1/4 cup flour\n1/4 cup butter or margarine, melted\n1  teaspoon vanilla extract\n1 12-ounce package semisweet chocolate morsels, melted\n1 1/2 cup walnut halves or pecan pieces\n1 piecrust\nJava Chocolate Sauce\nCoffee ice cream","Stir first 5 ingredients together until blended;\nStir in melted chocolate morsels and nuts.\n\nFill unbaked piecrust with mixture.\n\nBake at 375* for 30 minutes.  Cool.  Serve with coffee ice cream and java chocolate sauce.",""
