"Meat","FAMILY CURRIED BEEF POT PIE","","2 tablespoons olive oil\n1 large onion, cut into 1/4-inch dice\n1 tablespoon minced garlic\n1 tablespoon minced fresh ginger\n2 tablespoons curry powder\n3 tablespoons all-purpose flour\n1 cup diced (1 inch) carrots\n1 cup diced (1/2 inch) peeled potatoes\n3 cups beef broth\n2 cinnamon sticks, 3 inches long\n2 tablespoons chopped mango chutney\n1/2 cup golden raisins\n1/2 cup frozen peas, thawed\n1 tomato, cut into 1/2-inch dice\n1/4 cup chopped flat-leaf parsley\n2 cups diced (1/2 inch) leftover roast beef\nSalt and pepper, to taste\n1 sheet frozen puff pastry, thawed\n\n\n","1. Heat the oil in a large, heavy pot over low heat. Add the onion and cook, stirring, 8 minutes. Add the garlic, ginger, curry powder and flour; cook, stirring constantly, 2 minutes.\n2. Add the carrots, potatoes, broth and cinnamon sticks; simmer, partially covered, 20 minutes. Add the chutney, raisins, peas, tomato, parsley, beef, salt and pepper; cook 5 minutes more.\n3. Place the mixture in a 1 1/2-quart, round, ovenproof casserole dish. On a floured surface, roll the pastry into a circle 2 inches larger than the dish. Brush the dish rim with some of the egg ; cover with pastry, crimping the edges around the rim. Cut 3 slits in the top and brush with remaining egg. Bake in a 350F oven until golden, 40 minutes.\n\n\n","\nDrop biscuit topping\nCHEDDAR SCALLION DROP BISCUITS\nParade, Oct. 2007"
"Breads","CHEDDAR SCALLION DROP BISCUITS","12 BISCUITS","2 1/4 cups all-purpose flour\n2 1/2 teaspoons baking powder\n2 teaspoons sugar\n3/4 teaspoon baking soda\n1 teaspoon salt\n6 tablespoons (3/4 stick) cold unsalted butter, cut into 1/2-inch cubes\n6 oz Cheddar, coarsely grated (1 1/2 cups)\n3 scallions, finely chopped\n1 cup well-shaken buttermilk\n\n\n","Preheat oven to 450F.\nWhisk together flour, baking powder, sugar, baking soda, and salt in a bowl, then blend in butter with your fingertips until mixture resembles coarse meal. Stir in Cheddar and scallions. Add buttermilk and stir until just combined.\nDrop dough in 12 equal mounds about 2 inches apart onto a buttered large baking sheet. Bake in middle of oven until golden, 18 to 20 minutes.\n\n\n","Gourmet, January 2002"
"Meat","HUNTER'S STYLE BEEF PIE","6","1 tablespoon olive oil\n1 pound boneless sirloin steak, trimmed and cut into 1/2-inch cubes\n1 3/4 cups chopped onion (about 1 medium)\n2 garlic cloves, minced\n1 1/2 cups fat-free, less-sodium beef broth\n1/2 cup merlot or other dry red wine\n2 tablespoons no-salt-added tomato paste\n1 tablespoon low-sodium Worcestershire sauce\n1 1/2 cups sliced carrot (about 5 medium)\n1 cup sliced mushrooms\n2 thyme sprigs\n2 tablespoons all-purpose flour\n3 tablespoons water\n1/2 teaspoon salt\n1/4 teaspoon black pepper\nCooking spray\n1/2 (15-ounce) package refrigerated pie dough (such as Pillsbury)\n","Heat oil in a Dutch oven over medium-high heat. Add steak, onion, and garlic; cook 5 minutes or until steak is browned. Add beef broth and next 3 ingredients to pan; stir well to combine. Bring to a boil; reduce heat, and simmer, uncovered, 25 minutes, stirring occasionally.\nStir in carrot, mushrooms, and thyme; cover and simmer 30 minutes.\nCombine flour and water in a small bowl, stirring with a whisk; add to steak mixture in pan. Cook over medium heat 2 minutes or until thick. Remove and discard thyme; stir in salt and pepper.\nPreheat oven to 425.\nSpoon steak filling into a 9-inch deep-dish pie plate coated with cooking spray. Unroll pie dough; cut small slits in center to vent, and place over filling. Fold edges under; flute.\nBake at 425 for 17 to 18 minutes or until lightly browned.","Oxmoor House Healthy Eating Collection, 2008"
"","","","","",""
"Salads","SOUTHWESTERN SUMMERTIME QUINOA SALAD","","1 cup quinoa\n1 cup tomato, chopped\n1 (15 ounce) can black beans\n1 cup bell pepper, chopped\n1/4 cup scallion, chopped\n8 ounces corn\n1 seedless cucumber, chopped\n1/4 cup cilantro, chopped\n1/4 cup olive oil\n3 tablespoons lime juice\n1 teaspoon cumin\n1 teaspoon coriander\n2 teaspoons chili powder\nsalt and pepper\n\n\n","Cook quinoa according to package directions. Allow to cool.\nCombine quinoa with chopped vegetables.\nWhisk together remaining ingredients to make the dressing.\nThoroughly combine dressing with quinoa-vegetables mixture and chill.\nAdjust seasonings as preferred.\n\n\n","FOOD.COM"
"Pasta","PASTA PUTTANESCA ","4","2 tablespoons extra virgin olive oil\n2 -8 garlic cloves, depending on preference\n1 (2 ounce) can anchovy fillets \nred chili pepper flakes\n1 (32 ounce) can diced tomatoes\n1/4 cup crushed black olives\n1/4 cup stuffed olives sliced\n1 tablespoon capers, heaping\n1/4 cup chopped Italian parsley\n3 leaves fresh basil, chiffonade\n1 pound pasta cooked\nparmesan  or romano cheese grated","Add olive oil, garlic, anchovies and crushed pepper to large heated skillet over medium heat.\nSaute until the anchovies disolve into the oil and the garlic is tender.\nAdd the tomatoes, olives, and capers.\nSimmer sauce 6 to 8 minutes and add parsley and basil.\nTaste for salt and add fresh black pepper.  Toss with pasta, sprinkle with cheese and serve.","I added one jalapeno and two red banana peppers\nwww.food.com"
"Meat","CURRIED BEEF POT PIE","","2 tablespoons olive oil\n1 large onion, cut into 1/4-inch dice\n1 tablespoon minced garlic\n1 tablespoon minced fresh ginger\n2 tablespoons curry powder\n3 tablespoons all-purpose flour\n1 cup diced (1 inch) carrots\n1 cup diced (1/2 inch) peeled potatoes\n3 cups beef broth\n2 cinnamon sticks, 3 inches long\n2 tablespoons chopped mango chutney\n1/2 cup golden raisins\n1/2 cup frozen peas, thawed\n1 tomato, cut into 1/2-inch dice\n1/4 cup chopped flat-leaf parsley\n2 cups diced (1/2 inch) leftover roast beef\nSalt and pepper, to taste\n1 sheet frozen puff pastry, thawed\n\n\n"," 1. Heat the oil in a large, heavy pot over low heat. Add the onion and cook, stirring, 8 minutes. Add the garlic, ginger, curry powder and flour; cook, stirring constantly, 2 minutes.\n2. Add the carrots, potatoes, broth and cinnamon sticks; simmer, partially covered, 20 minutes. Add the chutney, raisins, peas, tomato, parsley, beef, salt and pepper; cook 5 minutes more.\n3. Place the mixture in a 1 1/2-quart, round, ovenproof casserole dish. On a floured surface, roll the pastry into a circle 2 inches larger than the dish. Brush the dish rim with some of the egg ; cover with pastry, crimping the edges around the rim. Cut 3 slits in the top and brush with remaining egg. Bake in a 350F oven until golden, 40 minutes.\n\n\n","Epicurious\n\nTop with pie crust or cream drop biscuits"
"Breads","CREAM DROP BISCUITS","12","2 1/2 cups all-purpose flour\n1 tablespoon baking powder\n1 teaspoon salt\n1 tablespoon sugar\n2 cups chilled heavy cream\n\n","Preheat oven to 400F.\nStir together flour, baking powder, salt, and sugar in a large bowl. Add cream, then stir just until a dough forms.\nDrop heaping 1/4 cups of batter about 1 inch apart on an ungreased large baking sheet. Bake in middle of oven until tops are pale golden and bottoms are golden brown, 18 to 20 minutes.\n\n\n","Gourmet, May 2001"
"Appetizers","PICO de GALLO","3 cups","3 medium ripe tomatoes, cored, seeded, and chopped\n2 fresh jalapeo peppers, seeded and minced\n1 bunch fresh cilantro, leaves chopped, stems discarded\n4 garlic cloves, minced\n3 red bell peppers, cored, seeded, and chopped\n1 red onion, chopped\nJuice of 1 lime\nKosher salt to taste\n\n\n","Combine all in large ceramic bowl.  Stir, add salt as needed","Epicurious April 2010"
"Desserts","CHOCOLATE GANACHE","1 quart","2 cups heavy cream\n4 tablespoons unsalted butter\n4 tablespoons granulated sugar\n12 ounces semisweet chocolate, broken into 1/2-ounce pieces\n6 ounces unsweetened chocolate, broken into 1/2-ounce pieces\n4 ounces white chocolate, broken into 1/2-ounce pieces","Heat cream, butter and sugar over medium high heat.  Stir to dissolve the sugar.  Bring the mixture to a boil.\n\nPlace the chocolates in a stainless steel bowl.  Pour the boiling cream over the chocolates and allow to stand for 5 minutes.  Stir until smooth.  Allow to cool to room temperature.","Marcel Desauliner"
"Sandwiches","TUNA AVOCADO SANDWICH","4","1 can (5 oz.) drained or 2.5 oz. tuna\n2 ripe avocados, mashed\n2 Tablespoons fresh lime or lemon juice\n1/4 cup roasted red pepper strips\n2 Tablespoons chopped fresh parsley\n1/2 easpoon garlic salt\n1/4 teaspoon black pepper\n8 slices multi-grain bread\n8 tomato slices\n8 slices red onion","Combine avocado, lime juice, red pepper strips, parsley, garlic salt and pepper.\n\nFlake and fold in tuna.\nFill each sandwich with 2 tomato slices. 1/4 avocado filling and 2 slices red onion","Martha Stewart Living  July 2011"
"Cakes","ROYAL ICING","2 1/2 cups","2 large egg whites, or more to thin icing\n4 cups sifted confectioner's sugar, or more to thicken icing\n1 lemon, juiced\n\n","Beat the whites until stiff but not dry.  Add sugar and lemon juice.  Beat for 1 minute more.  If icing is too thick, add more egg whites.  If it is too thin, add more sugar.  The icing may be stored in an airtight container in the refrigerator for up to 3 days.\n\n","Raw eggs should not be used in food prepared for pregnant women, young children, or anyone whose health is compromised."
"Appetizers","CRANBERRY SALSA","","4 cups cranberries\n1 whole fresh orange\ncilantro\njalapeno\nsugar to taste","Put cranberries and orange in Cuisinart, pulse until coursely ground.  Add other ingredients to taste.","From NRGC kitchen"
"Meat","GARLIC ROSEMARY-MARINATED LAMB CHOPS","2"," 1 teaspoon finely chopped lemon zest\n1 garlic clove, minced and mashed to a paste with 1/2 teaspoon salt\n1 1/2 teaspoons chopped fresh rosemary or 1/2 teaspoon crumbled dried\n1 tablespoon olive oil\nfour 1 1/4-inch-thick loin lamb chops (about 1 pound total)\n\n\n","\nPreheat the broiler. In a small bowl stir together the zest, the garlic paste, the rosemary, the oil, and pepper to taste, rub the lamb chops with the marinade, and let them marinate on a plate for 20 minutes. Broil the lamb chops on the rack of a broiler pan about 4 inches from the heat for 4 to 5 minutes on each side for medium-rare meat.\n\n","Gourmet, May 1993"
"Cakes","CRANBERRY UPSIDE DOWN CAKE","9","1 1/2 cups fresh cranberries\n2 Tablespoons chopped walnuts\n1 tsp. grated orange rind\n1/2 cup butter softened and divided\n1/2 cup packed dark-brown sugar\n 2 Tablespoons fresh orange juice\n1/4 teaspoon cinnamon \n1 1/2 cups flour\n1/2 teaspoon salt\n1 teaspoon baking powder\n1 cup granulated sugar\n1 teaspoon vanilla extract\n1 egg\n1/2 cup fat free buttermilk\nGLAZE: \n1 cup confectioners' sugar\n1 teaspoon melted butter\n2 Tablespoons fresh orange juice","Preheat oven to 350*; coat 9-inch square or 9-10-inch round pan with spray and flour.\nCombine cranberries walnuts, and orange rind.\nIn small saucepan, melt 2 Tbsp butter, stir in brown sugar, orange juice and cinnamon.  Cook 3 minutes stirring frequently.  Pour into prepared pan, and sprinkle with cranberry mixture\nWhisk flour, salt and baking powder together\nBeat sugar and remaining butter until creamy.\nAdd vanilla, egg, buttermilk and flour mixture in thirds.  Mix and spoon over cranberries.\nBake 40 minutes until straw inserted into center of cake comes out clean.  Cool in pan for 5 minutes, then invert  onto rack or serving plate.  Beat glaze ingredients together and drizzle over cake.","From January 15, 2012 Parade magazine."
"Soup","BROCCOLI-CHEESE SOUP","6-8","2 T. unsalted butter\n2 pounds broccoli, florets roughly chopped, stems peeled and chopped into 1/4"" slices\n1 med. onion chopped (1 cup)\n2 med. garlic cloves, minced (2 teaspoons)\n1 1/2 teaspoons dry mustard powde\nPinch cayenne pepper\nSalt\n3-4 cups water\n1/4 teaspoon baking soda\n2 cups low-sodium chicken broth\n2 ounces baby spinach (2 loosely packed cups)\n3 ounces sharp cheddar cheese (3/4 cups)\n1 1/2 ounces Parmesan cheese, grated fine\n    (about 3/4 cup) plus extra for serving\n  Ground black pepper","1-Heat butter in large Dutch oven.  Add broccoli, onion, garlic, dry mustard, cayenne, and 1 teaspoon salt. Cook until fragrant about 6 minutes.  Add 1 cup water and baking soda.  Simmer until broccoli is very soft (about 20 minutes.)\n2- Add broth and 2 cups wate.  When mixture begins to simmer, stir in spinach and cook until wilted, about 1 minute.  Transfer half soup to blender, add chese and process until smooth.  \nRepeat with remaining soup.  Return to Dutch oven, place over medium heat and bring to simmer.  Adjust consistency of soup with up to 1 cup water.  Season to taste.  Pass extra Parmesan cheese.","Cook's Illustrated March/April 2011"
"Breads","SOUR CREAM BISCUITS","12 biscuits","2 cups (10 ozs.) all purpose flour\n1 Tablespoon baking powder\n1 teaspoon salt\n1 (16-oz.) container sour cream\n7 Tablespoons unsalted butter, melted and cooled","Adjust oven rack to iddle position and heat to 425*.  Prepare baking sheet with parchment paper or butter and flour.\nCombine flour, baking powder, and salt.  Stir in sour cream and 5 tablespoons butter until combined.\nScoop and drop generous (slightly heaping) 1/4 cup of dough 2 inches apart onto prepared pan.\nBrush with remaining 2 tablespoons butte and bake until golden brown, 20 to 25 minutes, rotating sheet halfway through baking.  Let biscuits cool on sheet on wire rack for 15 minutes.  Serve warm.","Cook's Country  February/March 2012"
"Eggs","GREEN ONION & MUSHROOM OMELET","2","6 ounces crimini mushrooms\n2 tablespoons plus 2 teaspoons butter\n5 tablespoons chopped green onions\n1/4 cup dry vermouth\n\n\n6 large eggs\n1 tablespoon water\n1/4 teaspoon salt\n1/4 teaspoon ground black pepper\n\n\n","Finely chop mushrooms in processor. Melt 2 tablespoons butter in medium skillet over medium-high heat. Add mushrooms and 3 tablespoons onions; saut 3 minutes. Add vermouth and boil until evaporated, about 1 1/2 minutes. Season with salt and pepper.\nWhisk eggs, 1 tablespoon water, salt, and pepper in medium bowl to blend. Melt 1 teaspoon butter in small nonstick skillet over medium heat. Add half of egg mixture. Stir with back of fork until edges begin to set. Cook until omelet is set, lifting edges with spatula to let uncooked egg flow underneath, about 2 minutes. Spoon half of mushroom mixture down center of omelet. Fold both sides of omelet over filling and transfer to plate. Repeat with remaining butter, egg mixture, and mushroom mixture. Sprinkle omelets with remaining onions.\n\n","Bon Appetit, May 2001"
"","","","","",""
"Soup","VEGETARIAN SOUP","","1 large baking potato diced\n2 or 3 leeks diced\n2 or 3 diced carrots\n8 cups chicken broth\n1/2 cup orzo\n1 cup chopped green beans\n1 can cannellini or whole white beans\nSalt and pepper to taste\n1/4 teaspoon crushed red pepper","Dice vegetables and cook covered in heavy pot until they begin to get tender, about 10 minutes.\nPour in 8 cups broth.  Bring to a boil.\nAdd 1/2 cup orzo and boil until the orzo is tender, 10 to 12 minutes.\nAdd 1/2 cup chopped green beans or young asparagus.\nReduce the heat to a simmer; cook for 6 more minutes.  Pour in 1 can of cannellini or other white beans, salt and pepper to taste, and 1/3 teaspoon of crushed red pepper.  Cook until the cnnellini are heated through.  \n\nServe with crusty bread and a dollop of sour cream.","VP newspaper Feb. 2012\nI used canned green beans."
"Pies","PEAR TART","8","1/2 cup softened butter\nJuice of 1/2 lemon, divided\n1 lb. pears (Concord or Anjou)peeled, sliced 1/2 inch thick\n1 cup all-purpose flour\n1 teaspoon baking powder\n1/8 teaspoon salt\n1 cup plus 2 Tablespoons sugar\n2 eggs\n1 teaspoon vanilla extract\n1/2  teaspoon cinnamon","Butter 9-in spring form pan, squeeze half the lemon juice over pears\nWhisk together flour, baking powder and salt.\nCream butter and sugar until light and fluffy, about 3 minutes with electric mixer.  Beat in eggs one at a time, then vanilla.  Beat in flour mixture until batter comes together.  Spread in pan.  Wrap and chill for at least 20 m inutes.\nPreheat oven to 375*.  Arrange pears in tight concentric circles on top of dough.  Squeeze remaining lemon juice evenly over pears.\nIn bowl, mix 2 Tablespoons sugar with cinnamon.  Sprinkle over pears.  Bake for 45 to 55 minutes until edges are golden and center is set.  Cool in tart pan for 10 minutes.  Run a sharp knife around edge.  Remove sides of pan.","Parade Magazine"
"Salads","APPLE BROCCOLI SALAD","6","2 apples--McIntosh, empire or Courtland\n3 cups fresh broccoli, cut in bite size pieces\n1/4 cup walnuts\n1 Tablespoon red onion, chopped\n1/3 cup raisins\n1/2 cup low-fat vanilla yogurt"," Core and chop apples\nMix all ingredients together\nServe on a bed of lettuce","125.2 calories per serving "
"Breads","BISCUITS","8","2 cups bread flour\n2 cups all purpose flour\n2 Tablespoons baking powder\n2 Tablespoons sugar\n1 teaspoon salt\n1 cup butter, but into small cubes\n1 1/2 cups buttermilk\n1 large egg","Combine flours and next 3 ingredients in a large bowl.  Place cubed butter and flour mixture in freezer, separately, for 10 minutes.  Whisk milk and egg n a small bowl.\nCut chilled butter into flour mixture with a pastry blender until crumbly.  Add buttermilk mixture stirring just until dry ingredients are moistened.\nPreheat oven to 450*.  Turn dough onto a lightly floured surface and knead lightly 3 to 4 times.  Pat or roll dough to 1-inch thickness, but and place on greased pan or parchment paper-lined baking sheet.\nBake for 15 minutes or until golden brown.  Split biscuits, fill each with 1 cooked chicken thigh and desired toppings.","Southern Living April 2012 p. 106"
"Poultry","FRIED CHICKEN THIGHS & BISCUITS","8","8 skinned, boned chicken thighs\n1 teaspoon salt\n1/2 teaspoon pepper\n1/8 teaspoon onion powder\n1 cup buttermilk\n1 large egg\nVegetable 2 cups all-purpose flour","Salt and pepper, and onion powder on thighs.\nWhisk egg with buttermilk, add chicken, toss to\ncoat.\n\nFlour chicken 5 to 6 minutes in 325* oil until golden brown and done.  Drain.\n\nServe on split biscuit and desired toppings such as chopped pickled green tomatoes, local honey","Southern Living, April 2012 p. 106"
"Poultry","CHICKEN PICCATA","4","1/4 cup olive oil, divided\n1 pound boneless, skinless chicken breasts,\n   butterflied to 1/2 inch thick scallopini\n1 teaspoon kosher salt, divided\n1/2 cup flour\n1 medium shallot, peeled, minced\n4 leaves fresh sage, torn into small pieces\n8 lemon slices, 1/8 tinch thick\n1 clove garlic, thinly sliced\n1/4 cup chicken stock\n2 tablespoons lemon juice\n1 1/2 capers, drained, washed, and lightly chopped\n1 tablespoon minced flat leaf parsley\n2 tablespoons butter, cold\nGround black pepper","Pound chicken to 1/4 inch thickness, season with 3/4 teaspoon of the salt.  Dredge each piece of chicken through flour, coating both sides, shaking off access.\nIn large heated skillet add olive oil and chicken.  Cook for 3 minutes per side, or until golden and just cooked through.  Remove chicken and lower the heat to medium.\nAdd the shallot, sage and lemon slices to the pan.  Cook for 1 minute, then add the garlic.  Cook for 30 seconds, then ad the stock, lemon juice capers and parsley.  Simmer for 2 minutes, then whisk in the cold butter.  Season.  pour sauce over chicken and serve.","VP newspaper, 5/9/12"
"Sandwiches","OPEN-FACED PIMENTO CHEESE BLTs","4","2 Tablespoons diced pimentos, drained\n1 Tablespoon grated peeled shallots\n2 Tablespoons canola mayonnaise\n1 teaspoon cider vinegar\n1/4 teaspoon freshly ground black pepper\n4 ounces shredded reduced fat sharp cheddar cheese (about 1 cup)\n1.25 ounces grated fresh Parmesan cheese \n(about 1/3 cup)\n4 (1-ounce)  slices sourdough bread, toasted\n12 tomato slices\n1/4 teaspoon kosher salt\n4 center cut bacon slices, cooked and halved\n1 cup baby arugula leaves\n","Combine first 7 ingredients.  Spread 3 tablespoons cheese mixture on each bread slice; top each with 3 tomato slices.  Sprinkle =tomato with salt.  Top each sandwich with 2 bacon halves and 1/4 cup arugula","COOKING LIGHT, July 2012"
"Sauces","BARBECUE SAUCE","4 SERVINGS","1/4 cup vegetable oil\n1 medium onion, finely chopped (3/4 cup)\n3/4 cup ketchup\n1/3 cup lemon juice or vinegar\n3 T. brown sugar\n3 T. prepared mustard\n3 T. Worchestershire Sauce\n1 t. all purpose barbecue grill seasoning\n1 1/2 t. chili powder\n3 pounds bone-in chicken pieces, rinsed, patted \n   dry\nSalt and pepper","Heat oil in saucepan over medium heat.  Add onion; cook 5 minutes or until soft.  Add ketchup, lemon juice, sugar, mustard, Worchstershire sauce, grill seasoning and chili powder.  Reduce heat to low. Simmer 20 minutes, stirring occasionally.\n\n","The J. M. Smucker Company"
"Poultry","BARBECUED CHICKEN","4","3 pounds bone-in chicken pieces (breast halves, thighs and/or drumsticks), rinsed and patted dry.\n\nsalt and pepper","Heat grill to medium or broiler to high.  Sprinkle chicken generously with salt and pepper.  Place chicken on grill or on broiler pan about 8 inches from heat.\n\nCook chicken, basting with sauce* after 15 minutes.\nTurn chicken, basting after 10 minutes.  Cook an additional 5 minutes or until internal temperature reads 165* and juices run clear, turning and basting as needed.\n\n*See Barbecue Sauce recipe","The J.M. Smucker Company"
"Cakes","4-LAYER LEMON TORTE",""," 1 18 1/2-ounce package yellow cake mix\n 1/2 cup (1 stick) butter, room temperature\n 6 large eggs\n 1/2 cup whipping cream\n 1/2 cup water\n 1 tablespoon grated lemon peel\n 3/4 cup raspberry preserves\n Lemon Cream Cheese Frosting\n 1 1/2 cups sliced almonds, toasted\nLemon Cream Cheese Frosting\n\n3  8-oz. packages cream cheese, room temperature\n1  11-oz. jar lemon curd\n1  cup powdered conf. sugar\n 2  Tablespoons fresh lemon juice\n 1  teaspoon grated lemon peel\n\nBeat cheese and lemon curd until smooth\nAdd remaining ingredients\n","Preheat oven to 350F. Butter two 9-inch-diameter springform pans with 2 3/4-inch-high sides. Combine first 6 ingredients in large bowl. Beat until smooth, about 2 minutes. Divide batter between prepared pans. Bake cakes until tester inserted into center comes out clean, about 28 minutes. Cool cakes completely in pans on racks.\nUsing small knife, cut around sides of pans to loosen cakes. Remove pan sides. Using serrated knife, cut each cake horizontally in half. Place 1 cake layer, cut side up, on platter. Spread with 1/4 cup preserves, then 3/4 cup frosting. Top with second cake layer, cut side up. Spread with 1/4 cup preserves, then 3/4 cup frosting. Repeat with third cake layer. Top with fourth cake layer, cut side down. Spread remaining frosting over top and sides of cake. Press almonds onto sides of cake. Chill until frosting sets, about 2 hours. (Can be made 1 day ahead. Cover; keep chilled.)\n","See Lemon Cream Cheese Frosting"
"Pies","FIG CROSTATA","8","For pastry dough:\n2 cups all-purpose flour\n1/4 cup granulated sugar plus additional for sprinkling\n1/2 teaspoon salt\n1 1/2 sticks cold unsalted butter, cut into 1/2-inch cubes\n2 large egg yolks\n1 teaspoon pure vanilla extract\n1 tablespoon cold water\n\n\nFor fig filling:\n12 ounces soft dried figs (preferably Calmyrna), stemmed and coarsely chopped\n1 1/4 cups water\n1 cup fresh orange juice\n1/2 cup packed dark brown sugar\n1 stick unsalted butter, melted and cooled\n3 large eggs, lightly beaten\n1 teaspoon pure vanilla extract\n1 teaspoon grated orange zest\n1 1/2 cups walnuts (6 ounces), coarsely chopped\n\n\n","Make pastry dough:\nBlend together flour, sugar, salt, and butter in a bowl with a pastry blender (or pulse in a food processor) just until mixture resembles coarse meal with some roughly pea-size butter lumps. Add yolks, vanilla, and water and gently stir with a fork (or pulse) until incorporated and dough begins to form large clumps.\nTurn out dough onto a lightly floured surface and divide into 4 portions. With heel of your hand, smear each portion once or twice in a forward motion to help distribute fat. Gather all dough together (using a pastry scraper if you have one), then divide dough in half and form each half into a 5- to 6-inch disk. Chill, wrapped in plastic wrap, until firm, at least 1 hour.\nMake fig filling while dough chills: \nSimmer figs, water, orange juice, and brown sugar in a medium saucepan, covered, stirring occasionally, until figs are soft and mixture is reduced to about 2 cups, 15 to 20 minutes. Pulse in a food processor until finely chopped (mixture should not be smooth). Transfer to a large bowl and cool slightly. Stir in butter, eggs, vanilla, zest, and walnuts.\nMake tart shell: \nPreheat oven to 350F with rack in middle. Generously butter springform pan. Roll out 1 portion of dough between 2 sheets of parchment paper into a 12-inch round (dough will be soft; chill or freeze briefly if it becomes difficult to work with). Peel off top sheet of parchment and carefully invert dough into pan. (Dough will tear easily but can be patched together with your fingers.) Press dough onto bottom and 1 inch up side of pan, then trim excess. Chill tart shell until ready to assemble crostata.\nRoll out remaining dough between 2 sheets of parchment paper into a 12-inch round. Peel off top sheet of parchment, then cut dough into 10 (1-inch-wide) strips and slide (still on parchment) onto a tray. Chill until firm, about 10 minutes.\nAssemble crostata: \nSpread fig filling in shell. Arrange 5 strips of dough 1 inch apart on filling. Arrange remaining 5 strips 1 inch apart across first strips to form a lattice. Trim edges of strips flush with edge of shell. Sprinkle crostata with sugar.\nBake until filling is slightly puffed and pastry is pale golden, about 30 minutes. Cool completely, then remove side of pan. Serve crostata with mascarpone.v\n\n","From Epicurious"
