"Poultry","CHICKEN WITH DRIED CRANBERRIES & TARRAGON","4","3 Tablespoons flour\nsalt & pepper\n4 boneless chicken breasts, skin on\n2 Tablespoons oil\n3/4 Cup verjuice or 3/4 cup fruity white wine\n2 large shallots, finely chopped\n1 garlic clove, finely chopped\n1 1/2 cups chicken stock\n1/2 cup light cream\n1 cup dried cranberries\n1 teaspoon lemon juice\n1 teaspoon chopped fresh tarragon","heat oil i large skillet; combine flour, salt & pepper and dredge chicken breasts.  Cook skin side down turning until golden brown.  Transfer chicken to a baking dish, cook in 350* oven for 12-15 minutes\nDrain skillet and return to heat.  Deglaze pan with half the verjuice or wine, scraping browned bits.  \nAdd shallots, garlic, stock and cream; simmer util reduced to a consistency that coats the back of a wooden spoon.  Add remaining wine, cranberries and lemon juice.  Reduce sauce a bit more, season with salt and pepper.  Add the tarragon.\nTo serve, slice the chicken breasts on an angle, fan out onto plate.  Top slices with a generous amount of sauce.","https://www.geniuskitchen.com/recipe/chicken-with-dried-cranberries-and-tarragon-68437?ic1=suggestedAsset|chicken+with+dried+cranberries#activity-feed"
"Appetizers","FETA-OLIVE-FRESH HERB CHEESE BALL","","1 8-ounce package softened cream cheese\n2 Tablespoons softened butter\n1 teaspoon lemon zest\n2 teaspoons fresh lemon juice\n1/4 teaspoon Worchestershire sauce\nDash of Tabasco\n1/4 teaspoon kosher salt\n4 ounces feta cheese, crumbled\n1/4 cup green olives, pitted and finely chopped\n1/4 cup finely chopped fresh flat-leaf parsley\n2 Tablespoons green onions, finely chopped\nCucumber slices","Beat cream cheese and next 6 ingredients at medium speed with electric mixer 2-3 minutes.\nStir together crumbled feta cheese, chopped green olives, and cream cheese mixture until combined.\nChill 5 minutes.\nStir together chopped parsley and green onions.  Shape into a ball, roll in parsley mixture to coat. \nServe with cucumber slices.","https://www.myrecipes.com/recipe/feta-olive-fresh-herb-cheese-ball"
"Appetizers","CHICKEN LIVER MOUSSE-CROSTINI","","1/2 cup butter, divided\n1 cup finely chopped yellow onion\n1 garlic clove, minced\n1/2 cup heavy cream\n1 pound chicken livers\n1/2 teaspoon kosher salt\n1/4 teaspoon freshly ground black pepper\n2/3 cup red pepper jelly\n1 (8 to 9-ounce) French bread baguette, sliced and toasted","Preheat oven to 300*.  Melt 2 Tablespoons butter in a small saucepan over medium heat.  Stir in chopped onion.  Cover and cook, stirring occasionally,  to 7 minutes or until tender.  Add minced garlic and saute 10 seconds.  Stir in cream, and bring to a simmer.  Cover, reduce heat to low, and cook 6 minutes.\nAdd remaining 6 tablespoons butter and cook stirring constantly about 1 minute or until butter is melted and well blended.  Remove from heat\nProcess chicken livers, salt, pepper and onion mixture in a blender for 30-45 seconds until smooth. \nPlace 7 (8-oz.) wide-mouth, oven proof jars with tight-fitting lids in a 13 x 9 inch baking dish.  Divide liver mixture among jars, filling each halfway.  Add warm water to baking dish to a depth of 1 1/4 inches.  Cover jars and baking dish tightly with heavy duty aluminum foil.\nBake at 300* for 30 minutes or until mousse is set. Remove from oven, transfer jars to wire rack and cool.  Screw on lids and chill 1 hour\nJust before serving, spoon 1 1/2 Tablespoon red pepper jelly into each jar, and serve with toasted baguette slices","Southern Living on line"
"Poultry","LEMON HERB CHICKEN KEBABS","4","1/2 cup packed fresh flat-leaf parsley leaves, finely chopped\n1/2 cup packed fresh cilantro leaves, finely chopped \n2 tablespoons lemon juice 1 tablespoon packed fresh oregano, finely chopped \n1 tablespoon honey \n1/2 teaspoon crushed red pepper \n6 tablespoons olive oil, divided \n2 teaspoons kosher salt, divided\n1 teaspoon black pepper, divided \n1 1/4 pounds boneless, skinless chicken thighs, cut into 1-inch-wide strips \n12 ounces thick asparagus, cut into 1 12-inch pieces \n2 small lemons, very thinly sliced and seeds removed\n","Stir together first 6 ingredients, 5 tablespoons of oil, 1 teaspoon salt, and 1/2 teaspoon black pepper.  Add chicken; toss to coat; chill 1 hour.\nPreheat grill to 400*-450*\nToss asparagus and lemon slices with remaining oil. Remove chicken from marinade, discard marinade.  Thread chicken, asparagus and lemon slices on to 8 (8-inch) skewers, folding chicken strips and lemon slices in half as needed.  Sprinkle with remaining salt and black pepper.  Place on greased grill grate.  Grill until asparagus is tender and chicken is charred and cooked through 12-14 minutes, turning occasionally.","https://www.southernliving.com/recipes/lemon-herb-chicken-kebabs-recipe"
"Salads","CHICKEN QUINOA SALAD ","4","2/3 cup mayonnaise \n1 tablespoon chopped fresh chives \n1 teaspoon white wine vinegar\n1/2 teaspoon anchovy paste \n1 teaspoon lemon zest plus \n1 Tbsp. fresh juice (from 1 lemon) \n1/4 teaspoon black pepper \n1/2 cup loosely packed fresh parsley leaves, divided \n1/3 cup loosely packed fresh tarragon leaves, divided\n 3/4 teaspoon kosher salt, divided \n3/4 cup water \n1/2 cup uncooked quinoa \n5 cups torn butter lettuce (from 1 head) \n3 cups pulled rotisserie chicken (from 1 chicken) \n1/2 cup thinly sliced English cucumber (from 1 cucumber) 1/2 cup thinly sliced radishes (about 5 radishes)\n","Process mayonnaise, chives, vinegar, anchovy paste, lemon zest, lemon juice, black pepper, 1/4 cup of the fresh parsley, 1 tablespoon fresh tarragon 1/4 teaspoon salt in a food processor until smooth about 1 to 2  minutes.  Set aside.\nBring water, quinoa and 1/2 teaspoon salt to a boil over medium heat.  Stir and cover.  Reduce heat to low, and cook until quinoa is tender and liquid is absorbed, about 15 minutes.  Remove from heat and let stand 5 minutes, fluff with fork.\nToss lettuce remaining   parsley and tarragon leaves.  Toss mixture with 1/4 cup of the dressing.  Transfer to serving platter.  sprinkle cooked quinoa over lettuce mixture.  Top with pulled chicken.  Arrange sliced cucumbers and radishes on top.  Drizzle with an additional 1/4 cup dressing and serve remaining dressing on the side.\n","https://www.southernliving.com/recipes/chicken-quinoa-salad-green-goddess-dressing-recipe"
"Condiment","MANGO CHUTNEY","3 cups","3 large mangoes, peeled and chopped (about 2 lbs.)\n1 12 cups chopped onions\n12 cup peeled chopped cooking apple (Granny Smith)\n12 cup raisins\n1 cup cider vinegar\n1 14 cups firmly packed brown sugar\n12 cup sugar\n14 cup finely chopped fresh ginger\n12 teaspoon grated lime rind\n2 tablespoons lime juice\n1 tablespoon mustard seeds\n1 12 teaspoons celery seeds\n34 teaspoon salt\n14 teaspoon ground cinnamon\n14 teaspoon ground cloves","Mix all the ingredients together in a large glass bowl.\nCover and chill 8 hours.\nTransfer mixture to a large pot.\nBring to a boil over medium heat.\nLower the heat and cook 1 1/2 hours, stirring frequently.\nDivide mixture into airtight containers.\nStore in refrigerator up to 1 week; may keep in freezer for up to 6 months.","Geniuskitchen.com/recipe/moms-mango-chutney-92982"
"Appetizers","DINNER ROLL SANDWICHES","","2hawaiian rolls (packs)\n1pound ham (shaved)\n12ounces shredded swiss cheese\n\nSAUCE:\n2sticks melted butter\n2tablespoons mustard\n1tablespoon worcestershire sauce\n1teaspoon onion\n2tablespoons poppy seeds\n","Preheat oven to 325. Slice rolls horizontally as a unit  dont break apart into individual rolls. Put the bottoms in a 913 dish. Lay meat on top. Cover with cheese. Pour 2/3-3/4 of sauce on top of cheese. Place tops of rolls on top. Pour remaining mixture over tops of rolls and spread evenly. Bake for 15-20 minutes. Watch closely  they scorch easily!!! These can also be made ahead of time and refrigerated before baking.","https://www.yummly.com/recipe/Dinner-Roll-Sandwiches-1552599?prm-v1&utm_medium=email&utm_campaign=popular-searches-email&personalizedFor=3ebdd46b-e1c0-4569-95bb-234bb657897e&utm_content=dinner#directions"
"Sandwiches","DEVILED EGG SALAD/ASPARAGUS TARTINES ","8","6 hard-cooked eggs, peeled \n3 tablespoons mayonnaise \n1 tablespoon Dijon mustard \n1 1/2 teaspoons finely chopped fresh dill \n1 1/2 teaspoons finely chopped fresh chives \n2 scallions, finely chopped \n2 teaspoons dill pickle brine or fresh lemon juice \n1 teaspoon hot sauce \n1/2 teaspoon kosher salt \n1/4 teaspoon black pepper \n1 pound asparagus \n3 tablespoons salted butter, at room temperature \n8 white sandwich bread slices, crusts removed, toasted\n","Step 1\nUsing a fork, finely crush eggs in a medium bowl. Stir in mayonnaise, mustard, dill, chives, scallions, brine, hot sauce, salt, and pepper.\nStep 2\nBring a medium saucepan of salted water to a boil over high. Fill a large bowl with ice water. Cut tip ends of asparagus spears into 4-inch lengths (the same length as bread slices); discard remaining asparagus spears or reserve for another use. Cook asparagus tips in boiling water until tender-crisp, 30 seconds to 1 minute; drain. Plunge into ice water to stop the cooking process; drain and pat dry.\nStep 3\nSpread butter evenly on toasted bread slices; cut bread slices in half lengthwise. Spread egg mixture evenly over butter; top with 2 or 3 asparagus tips. Serve immediately, or cover with damp paper towels, and chill up to 1 hour.","https://www.southernliving.com/recipes/deviled-egg-salad-and-asparagus-tartines-recipe"
"Soup","DUTCH SPLIT-PEA SOUP","","9 cups water\n1 pound dried green split peas\n2 pounds smoked pork hocks\n6 leeks, sliced\n4 stalks celery with leaves, sliced\n2 cloves chopped garlic\n1 1/2 teaspoons crushed dried savory leaves\n1 1/2 teaspoons salt\n1/2 teaspoon pepper\n1 pound cooked smoked sausage.","","The soup we used to take skiing."
"Breads","COOK'S ILLUSTRATED BLUEBERRY MUFFINS","12","2 cups flour\n1 Tablespoon baking powder\n1/2 teaspoon salt\n1 large egg\n1 cup sugar\n4 Tablespoons butter, melted and cooled\n1 1/4 cups sour cream\n1 1/2 cups frozen blueberries, preferably wild","Whisk flour, baking powder, salt in medium bowl until combined.  Whisk egg in second bowl until light colored; add sugar and whisk until thick about 30 seconds.  Add melted butter  in 2 or 3 steps,whisking after each addition.  Add sour cream, whisking just to combine.\nAdd frozen berries to dry ingredients, toss.  Add sour cream mixture and fold until batter comes together and berries are evenly distributed.  Batter will be thick.  Do not overmix.\nScoop large spoon full into prepared muffin tins (greased and floured or lined with cup cake liners).\nBake in 350* oven for 25 to 30 minutes or until brown.","from geniuskitchencom/recipe/best-blueberry-muffins"
"Breakfast","MINI BANANAS FOSTER STICKY BUNS","24 small","6 Tablespoons butter, divided\n3/4 cup firmly packed light brown sugar, divided\n2 medium size ripe bananas, thinly sliced\n1 1/2 Tablespoons light rum, divided\n1/2 teaspoon ground cinnamon\n6 Tablespoons granulated sugar, divided\n2 8-ounce cans refrigerated crescent rolls\n1/2 cup butter, very softened\n1/4 cup heavy cream\n1/4 teaspoon kosher salt\n1/2 cup plus 1 to 3 Tbsp. powdered sugar, sifted\n1/3 cup chopped toasted pecans.\n","Melt 2 tablespoons butter in medium skillet; stir in 1/4 cup of brown sugar until combined.  Stir in bananas and 1/2 tablespoon rum; cook, stirring until bananas soften and begin to break down, 3 to 4 minutes.  Let cool completely, 20 minutes\nPreheat oven to 375* Stir cinnamon, 1/4 cup brown sugar and 2 tablespoons granulated sugar in a small bowl.  Unroll 1 can of roll dough.  Separate dough piece along center perforation to form 2 (7 1/2 x 6 inch) rectangles; press perforations to seal.  Repeat with 2nd can.\nSpread the 4 tough rectangles wvenly with the softened butter, and sprinkle each with about 2 tablespoons of cinnamon sugar mixture.  Dollop each rectangle with 1/4 of cooled banana mixture, and spread a thin layer of the mixture to within 1/4 inch of edges.  Roll up each rectangle, jelly-roll fashion starting at long end. Cut each lot into 6 even slices.  Place rolls in 2 (12-cup) mini muffin pans lined with miniature paper baking cups.  Bake until golden brown 14 to 16 minutes.  Cool.\nPlace cream, salt, remaining 1/4 butter and sugars in a small saucepan over medium heat.  Bring to a boil; boil 1 minute.  remove from heat and whisk in remaining 1 tablespoon rum.  Whisk in 1 to 3 tablespoons powdered sugar, 1 spoon at a time until desired consistency is reached.  Drizzle slightly warm buns with glaze, and sprinkle with toasted pecans.","https://www.southernliving.com/recipes/bananas-foster-sticky-buns"
"Cookies","DATE OATMEAL COOKIES","","2 sticks butter, softened\n1 cup brown sugar, packed\n1/2 cup granulates sugar\n2 eggs\n1 teaspoon soda\n1 teaspoon cinnamon\n1 teaspoon vanilla\n1 1/2 cups flour \n3 cups oats\n8 ounces chopped dates\nnuts, optional","Cream butter and sugars.\nAdd eggs beating well after each.\nAdd vanilla.\nMix soda, cinnamon and flour;  add to butter mix.\nAdd oats; mix; add dates and nuts.\nBake at 350* ","Recipe from back of date box called for 2 boxes of chopped dates.  I used one."
"Vegetables","DEVILED POTATOES","10","1 pound petite red potatoes (about 15) \n1 tablespoon olive oil \n1 1/2 teaspoons kosher salt, divided \n1/2 cup sour cream \n2 tablespoons brined capers, drained and rinsed \n2 teaspoons chopped fresh flat-leaf parsley \n2 teaspoons chopped fresh dill \n2 teaspoons whole grain mustard \n1 teaspoon lemon zest \nGarnish: chopped fresh flat-leaf parsley","Oven 350* drizzle potatoes with oil and 1 teaspoon of the salt; toss to coat.  Spread in a single layer on a baking sheet, bake until tender when pierced about 40 minutes.  Cool 15 minutes.\nCut each potato in half, scoop out pulp into a medium bowl, leaving shells intact.  Place shells, cut side up on baking sheet, and bake until dry about 10 more minutes.  Cool 30 minutes\nStir together pulp, sour cream, capers, parsley, dill, mustard, zest and remaining 1/2 teaspoon salt.\nSpoon mixture into each shell. Top with lemon zest curls and parsley.","Southernliving.com/syndication/deviled-potatoes"
"Desserts","PAVLOVA","10","1  cups (10 ounces) sugar	\n cup (6 ounces) egg whites (5 to 7 large eggs)	\n1  teaspoons distilled white vinegar	\n1  teaspoons cornstarch	\n1 teaspoon vanilla extract	\nTOPPING:\n3 large mangos, peeled, pitted, and cut into -inch pieces (3 cups)	\n4 kiwis, peeled, quartered lengthwise, and sliced crosswise  inch thick (about 1 cup)	\n5 ounces (1 cup) blueberries	\n1 tablespoon sugar	\nWhipped Cream\n2	cups heavy cream, chilled	\n2	tablespoons sugar	\n","250*Combine sugar and egg whites in bowl of stand mixer; place bowl over saucepan filled with 1 inch simmering water, making sure that water does not touch bottom of bowl. Whisking gently but constantly, heat until sugar is dissolved and mixture registers 160 to 165 degrees, 5 to 8 minutes.\nFit stand mixer with whisk attachment and whip mixture on high speed until meringue forms stiff peaks, is smooth and creamy, and is bright white with sheen, about 4 minutes (bowl may still be slightly warm to touch). Stop mixer and scrape down bowl with spatula. Add vinegar, cornstarch, and vanilla and whip on high speed until combined, about 10 seconds.\nSpoon meringue on to parchment marked circles, spread to 1 inch high with 1/4 inch depression in center.\nBake 1 1/2 hours until exterior is dry and crisp, and meringue lifts from parchment when edge is gently lifted.  Color should be quite pale.  Prop oven door open with wooden spoon and cool completely for 1 1/2 hours.","https://www.cooksillustrated.com/recipes/11238-mango-kiwi-and-blueberry-pavlova-with-whipped-cream?sqn=y66OVSKy%2FQq9Q%2FmfL5Vk0auHwGTgOSxn5W3ABwV43gw%3D%0A&utm_source=Email&utm_medium=Newsletter&utm_term=NTK&utm_content=TestCooks&utm_campaign=190329&j=46635&sfmc_sub=10320780&l=26_HTML&u=21081897&mid=7211371&jb=1125&sk=48F8596CFDA1689FD4A58C6062343015&extcode=LN19C5QAA&sourcekey=BL19035AA&cds_response_key=&cds_tracking_code=&tag=atkntk1-20&atc=ntkA&Survey_id=&mi_ecmp="
"Appetizers","SPINACH AND VIDALIA DIP ","12","3 tablespoons (1 1/2 oz.) salted butter \n4 cups chopped Vidalia or other sweet onions (about 2 large) \n1 (5-oz.) pkg. fresh baby spinach, coarsely chopped \n1 teaspoon kosher salt, divided 1/2 teaspoon black pepper, divided \n1 (16-oz.) container sour cream 2 tablespoons chopped fresh chives \nPotato chips and medley of veggies like cucumbers, radishes, and bell peppers\n\n\n","Melt butter in a non stick pan, add onions and cook, stirring often until golden and very tender, 20 to 30 minutes.  Add spinach stirring just until wilted, about 1 minute.  Sprinkle 1/2 teaspoon salt and 1/4 teaspoon pepper.  Remove from heat and let stand 30 minutes\nStir onion/spinach mixture with sour cream and chives.  Add remaining salt and pepper.  Cover and chill 30 minutes or up to 2 days.  Serve with chips and veggies. Peppers, cukes, radish, baby carrots and chips.","https://www.myrecipes.com/recipe/spinach-and-vidalia-dip"
"Appetizers","CORN CAKES/SMOKED SALMON","4 dozen","1 8.25 ounce can cream style corn\n1 cup plain white cornmeal\n1 cup sour cream\n2 Tablespoons vegetable oil\n1 1/2 teaspoons baking powder\n1 teaspoon salt\n2 large eggs\n1 cup creme fraiche\n2 tablespoons finely chopped fresh dill\n1 Tablespoon Fresh lemon juice\n2 (4-oz.) packages thinly sliced smoked salmon, flaked\nFresh dill garnish\n\n\n\n","350* oven\nWhisk together first 7 ingredients until smooth.  Spoon 1 heaping teaspoon corn mixture into each cup of a well greased 24-cup miniature muffin pan.  Bake for 20 minutes.  Cool.\nStir together creme fraiche, dill and lemon juice.  Top muffins with creme fraiche and salmon.  Garnish with dill frond.","Southern Living Best Party Appetizers"
"Pasta","CHEESY SMOKED SAUSAGE PASTA","","1 Tablespoon olive oil\n1 pound sausage\n1/2 cup diced onion\n1 Tablespoon minced garlic\n2 cups chicken broth\n1 14-ounce can diced tomatoes\n1/2 cup milk\n8 ounces dry pasta\n1/2 teaspoon sale and pepper, each\n2 cups shredded cheddar-jack cheese\n1/4 teaspoon red pepper flakes\n1/3 cup chopped scallions, for garnish","Saute onions and sausage in olive oil for 5 minutes\nAdd garlic and all seasonings; cook for 2 minutes.\nAdd chicken broth, tomatoes, milk, and pasta; bring to a boil; lower heat and cover for 15 minutes. Stir to keep from sticking.\nStir in cheese\nGarnish and serve","https://www.yummly.com/recipe/One-Pan-Cheesy-Smoked-Sausage-_-Pasta-2597055#directions"
"Salads","SMITHFIELD HAM SALAD","","2 cups ground Smithfield ham\n1/2 cup chopped celery\n1/4 cup chopped onion\n1 teaspoon Dijon mustard\n2 hard boiled eggs, chopped\n1/4 cup pickle relish\n1/2 cups good mayonnaise","Mix all.","Paula Dean"
"","","","","",""
"Pork","SMITHFIELD HAM SALAD","","2 cups ground Smithfield ham\n1/2 cup chopped celery\n1/4 cup chopped onion\n1 teaspoon Dijon mustard\n2 hard boiled eggs, chopped\n1/4 cup pickle relish\n1/2 cups good mayonnaise","Mix all.","Paula Deen"
"Salads","TARRAGON CHICKEN SALAD","","MIX:\n1 cup mayonnaise\n3 Tablespoons minced fresh tarragon\n1 Tablespoon fresh lemon juice\n1 teaspoon lemon zest\nADD:\n4 cups cooked chopped chicken breast\n1 chopped Granny Smith apple\n1 cup celery\n4 Tablespoons red onion\nSalt and Pepper\nPecans\n","Mix first four ingredients.\nAdd chicken, apple, celery and onion\nSalt and pepper to taste\n\nAdd toasted pecans before serving.",""
"Breakfast","FRENCH TOAST CASSEROLE","6","1 cup packed light brown sugar \n6 tablespoons butter, melted \n1 cup pure maple syrup, divided \n1 cup chopped toasted pecans, divided \n12 (1-inch-thick) baguette slices (from 1 baguette, ends discarded) \n5 large eggs, lightly beaten \n1 1/4 cups whole milk \n2 tablespoons granulated sugar 1 teaspoon orange zest plus 1 Tbsp. fresh juice (from 1 orange) \n1/2 teaspoon ground cinnamon 1 1/4 teaspoons vanilla extract, divided \n2 tablespoons (1 oz.) bourbon Powdered sugar, for serving\n","Stir brown sugar, butter, and 1/4 cup o the maple syrup together.  Spread into a 13 x 9 inch baking dish; sprinkle with 3/4 cup of the pecans.  Arrange baguette slices on top.\nWhisk together next 5 ingredients and 1 teaspoon of the vanilla.  Pour over bread; chill  8 hours.\nPreheat oven to 350*; let dish stand at room temperature for 10 minutes; bake uncovered for about 35 m inutes.\nCombine bourbon and remaining 3/4 cup maple syrup and 1/4 teaspoon vanilla in a saucepan.  Cook over low, stirring, until warm, 2 minutes.  Remove from heat; cover pan.\nSprinkle casserole with powdered sugar and remaining 1/4 cup of pecans.  Serve with Bourbon-Maple Syrup.","SOUTHERN LIVING"
"Breads","MARK'S BISCUITS","12","2 cups flour\n6 Tablespoons butter\n3/4 cup buttermilk\n1 Tablespoon baking powder\n1/2 teaspoon baking soda\n1/2 teaspoon salt","Chop butter into 1/4 teaspoon size;  place in cuisinart with flour and other dry ingredients.\nPulse, add buttermilk with machine running until incorporated.  Remove to cutting board and fold and flatten four times.  Smooth out dough to 1/2 thickness.  Cut biscuits and place on parchment covered baking pan.\nBake at 375* for 15 minutes.","From Mark E."
"Poultry","CHICKEN--ANDOUILLE GUMBO","10 cups","1 lb. andouille sausage, cut 1/4 inch thick slices\n1/2 cup peanut oil\n3/4 cup all purpose flour\n1 large onion, coarsely chopped\n1 red bell pepper, coarsely chopped\n1 cup thinly sliced celery\n2 garlic cloves minced\n2 teaspoons Cajun seasoning\n1/8 teaspoon ground red pepper (optional)\n1 48-ounce container chicken broth\n2 pounds skinned boned chicken breasts\nRoasted Potatoes or cooked orzo\nFresh parsley cooked crumbled bacon, hot sauce","Cook sausage until browned, remove from pan; drain and pat dry.\nHeat oil in Dutch oven, gradually whisk in flour and cook 18 to 20 minutes until flour is caramel colored.  Do not burn.  Reduce heat to low, and cook, whisking constantly until mixture is milk chocolate-colored and texture is smooth, about 2 minutes.\nStir in onion and next 4 ingredients.  Cook 3 minutes.  Gradually stir in chicken broth.  Add chicken and sausage, increase heat, bring to boil.  Reduce heat to low and simmer 1 hour and 30 minutes or until chicken is done.  Shred chicken into large pieces.\nPlace in serving bowls, serve over roasted potatoes or cooked orzo.","May substitute shrimp for sausage.  I do not use peanut oil, but butter, and less flour."
"Meat","OLD FASHIONED MEAT LOAF","6-8","2 pounds ground beef\n3 stalks celery, chopped\n1/2 large onion, chopped\n1/2 cup Italian-seasoned bread crumbs\n2 eggs, beaten\n1/3 cup catsup\n2 Tablespoons Worchestershire Sauce\n1 teaspoons Greek seasoning\n2 teaspoon Creole seasoning\n1 teaspoon garlic powder\n1 8-ounce can tomato sauce\n3 Tablespoons tomato paste\n1 Tablespoon ketchup\nGarnish:  chopped parsley","Saute celery and onion  7 minutes in 1 tablespoon butter.\nAdd bread crumbs, 1 Tablespoon Worchestershire sauce, and next 5 ingredients;  mix well; add ground beef, mix and shape into loaf.\nBake at 350* for 45 minutes;  remove from oven and cover top with mixture of tomato sauce, remaining tablespoon Worchestershire sauce, tomato paste, and 1 tablespoon ketchup .  Bake 10-15 additional minutes or until slightly brown.  Cool 10 minutes before serving.\n","Southern Living"
"Breakfast","CREME BRULEE FRENCH TOAST","6-8","4 eggs \n4 egg yolks \n1 3/4 cups whole milk \n1 cup heavy cream \n1/2 cup sugar \n2 tablespoons orange liqueur (such as Grand Marnier) \n2 teaspoons vanilla bean paste (or vanilla extract) \n1/2 teaspoon salt \n8 (1-inch thick) slices of challah bread \n1 cup brown sugar \n1/2 cup unsalted butter \n2 tablespoons light corn syrup","Whisk together eggs, yolks, milk, and cream.  Add sugar, liqueur, vanilla, and salt; whisk until sugar is dissolved.\nPlace bread slices face down in a single layer in a 10 x 15-inch baking dish.  Pour custard over bread, cover and refrigerate 8 hours or overnight, flipping slices over in the custard after 1 hour of soaking.\nLine a rimmed baking sheet with aluminum foil.  Preheat oven to 375*.  Combine brown sugar, butter, and syrup in medium saucepan over medium high heat.  Stir until sugar is dissolved and boiling.  Pour sugar mixture onto lined baking sheet and spread evenly while still hot.  Lift each piece of toast out of custard, allowing excess to drip off, and place face down onto the warm caramel.\nBake in oven until top of the French toast is dry and lightly browned, 25 to 30 minutes.  Flip each piece over with caramel side up; serve with whipped cream.","https://www.southernliving.com/recipes/creme-brulee-french-toast"
